{
 "type_id": "2027-digital-planner",
 "built_at": "2026-10-27T14:02:48Z",
 "basis": {
  "listings": 30,
  "reviews": 572,
  "reviews_coded": 511,
  "off_type_dropped": 21,
  "negative_reviews": 201,
  "feature_sources": [
   "titles"
  ],
  "photos": "pending"
 },
 "features": [
  {
   "id": "dated",
   "name": "Dated for the year",
   "have": [
    "4569891656",
    "1123882489",
    "4520368146",
    "776177381",
    "4474152544",
    "661944197",
    "1305090483",
    "1784469516",
    "1125534670",
    "1282376971",
    "4518430837",
    "868166703",
    "4520841266",
    "1209326250",
    "4574328844",
    "848934785",
    "4520897436",
    "950727345",
    "4514378454",
    "1632709290",
    "1867253627",
    "1344352293",
    "809907874",
    "1873340215",
    "757624266",
    "1345063957",
    "843418806",
    "4310825773"
   ],
   "share": 0.933,
   "revenue_share": 0.962,
   "sales_share": 0.999,
   "tier": "standard"
  },
  {
   "id": "multi_year",
   "name": "Covers more than one year",
   "have": [
    "1123882489",
    "4520368146",
    "776177381",
    "4474152544",
    "661944197",
    "1305090483",
    "1784469516",
    "1125534670",
    "1282376971",
    "4518430837",
    "868166703",
    "4520841266",
    "4520897436",
    "4514378454",
    "1867253627",
    "809907874",
    "1873340215",
    "757624266",
    "1345063957"
   ],
   "share": 0.633,
   "revenue_share": 0.305,
   "sales_share": 0.817,
   "tier": "standard"
  },
  {
   "id": "goodnotes",
   "name": "Says Goodnotes",
   "have": [
    "4520368146",
    "4474152544",
    "661944197",
    "1784469516",
    "1282376971",
    "4518430837",
    "1209326250",
    "848934785",
    "950727345",
    "4514378454",
    "1632709290",
    "1867253627",
    "809907874",
    "1873340215",
    "4550281756",
    "843418806"
   ],
   "share": 0.533,
   "revenue_share": 0.222,
   "sales_share": 0.522,
   "tier": "common"
  },
  {
   "id": "journal",
   "name": "Journal or notebook pages",
   "have": [
    "4569891656",
    "661944197",
    "1784469516",
    "4539223391",
    "1209326250",
    "4574328844",
    "1632709290",
    "1867253627",
    "1344352293",
    "809907874",
    "843418806"
   ],
   "share": 0.367,
   "revenue_share": 0.72,
   "sales_share": 0.403,
   "tier": "common"
  },
  {
   "id": "notability",
   "name": "Says Notability",
   "have": [
    "4520368146",
    "4474152544",
    "1784469516",
    "848934785",
    "950727345",
    "1632709290",
    "1873340215",
    "4550281756",
    "843418806"
   ],
   "share": 0.3,
   "revenue_share": 0.16,
   "sales_share": 0.241,
   "tier": "common"
  },
  {
   "id": "undated",
   "name": "Undated version",
   "have": [
    "1123882489",
    "776177381",
    "661944197",
    "1305090483",
    "1125534670",
    "809907874",
    "757624266",
    "4550281756"
   ],
   "share": 0.267,
   "revenue_share": 0.089,
   "sales_share": 0.546,
   "tier": "rare"
  },
  {
   "id": "bundle",
   "name": "Bundle of several products",
   "have": [
    "4569891656",
    "1123882489",
    "4539223391",
    "1209326250",
    "4574328844",
    "1344352293",
    "4310825773"
   ],
   "share": 0.233,
   "revenue_share": 0.699,
   "sales_share": 0.206,
   "tier": "rare"
  },
  {
   "id": "custom",
   "name": "Customizable or personalized",
   "have": [
    "1123882489",
    "776177381",
    "1305090483",
    "1125534670",
    "4520841266",
    "4520897436",
    "757624266"
   ],
   "share": 0.233,
   "revenue_share": 0.098,
   "sales_share": 0.395,
   "tier": "rare"
  },
  {
   "id": "all_in_one",
   "name": "All-in-one life planner",
   "have": [
    "4474152544",
    "1784469516",
    "950727345",
    "1867253627",
    "1344352293",
    "1873340215"
   ],
   "share": 0.2,
   "revenue_share": 0.114,
   "sales_share": 0.194,
   "tier": "rare"
  },
  {
   "id": "hyperlinked",
   "name": "Hyperlinked tabs and dates",
   "have": [
    "4520368146",
    "4518430837",
    "950727345",
    "1867253627",
    "1873340215"
   ],
   "share": 0.167,
   "revenue_share": 0.087,
   "sales_share": 0.074,
   "tier": "rare"
  },
  {
   "id": "adhd_specific",
   "name": "Built for ADHD",
   "have": [
    "661944197",
    "1282376971",
    "1344352293",
    "809907874"
   ],
   "share": 0.133,
   "revenue_share": 0.037,
   "sales_share": 0.221,
   "tier": "rare"
  },
  {
   "id": "self_care",
   "name": "Self-care, mood or wellness pages",
   "have": [
    "4539223391",
    "1282376971",
    "1344352293"
   ],
   "share": 0.1,
   "revenue_share": 0.043,
   "sales_share": 0.07,
   "tier": "rare"
  },
  {
   "id": "goals",
   "name": "Goal setting",
   "have": [
    "1209326250",
    "1344352293",
    "4310825773"
   ],
   "share": 0.1,
   "revenue_share": 0.031,
   "sales_share": 0.054,
   "tier": "rare"
  },
  {
   "id": "eink",
   "name": "E-ink tablets (reMarkable, Boox, Kindle Scribe)",
   "have": [
    "4520841266",
    "4520897436",
    "4310825773"
   ],
   "share": 0.1,
   "revenue_share": 0.053,
   "sales_share": 0.001,
   "tier": "rare"
  },
  {
   "id": "habit_tracker",
   "name": "Habit tracker",
   "have": [
    "4539223391",
    "1282376971"
   ],
   "share": 0.067,
   "revenue_share": 0.026,
   "sales_share": 0.056,
   "tier": "rare"
  },
  {
   "id": "budget",
   "name": "Budget or finance pages",
   "have": [
    "1209326250",
    "1344352293"
   ],
   "share": 0.067,
   "revenue_share": 0.018,
   "sales_share": 0.053,
   "tier": "rare"
  },
  {
   "id": "android",
   "name": "Android or Samsung support",
   "have": [
    "1282376971",
    "1345063957"
   ],
   "share": 0.067,
   "revenue_share": 0.002,
   "sales_share": 0.078,
   "tier": "rare"
  },
  {
   "id": "landscape",
   "name": "Landscape layout",
   "have": [
    "4474152544",
    "1345063957"
   ],
   "share": 0.067,
   "revenue_share": 0.049,
   "sales_share": 0.027,
   "tier": "rare"
  },
  {
   "id": "portrait",
   "name": "Portrait layout",
   "have": [
    "4474152544",
    "848934785"
   ],
   "share": 0.067,
   "revenue_share": 0.049,
   "sales_share": 0.04,
   "tier": "rare"
  },
  {
   "id": "minimalist",
   "name": "Minimalist look",
   "have": [
    "4518430837",
    "1345063957"
   ],
   "share": 0.067,
   "revenue_share": 0.022,
   "sales_share": 0.024,
   "tier": "rare"
  },
  {
   "id": "meal",
   "name": "Meal planning",
   "have": [
    "1209326250"
   ],
   "share": 0.033,
   "revenue_share": 0.001,
   "sales_share": 0.039,
   "tier": "rare"
  },
  {
   "id": "colorful",
   "name": "Colorful or aesthetic look",
   "have": [
    "1282376971"
   ],
   "share": 0.033,
   "revenue_share": 0.002,
   "sales_share": 0.055,
   "tier": "rare"
  },
  {
   "id": "student",
   "name": "Student or academic",
   "have": [
    "4514378454"
   ],
   "share": 0.033,
   "revenue_share": 0.019,
   "sales_share": 0.002,
   "tier": "rare"
  },
  {
   "id": "work",
   "name": "Work or productivity focus",
   "have": [
    "4310825773"
   ],
   "share": 0.033,
   "revenue_share": 0.013,
   "sales_share": 0.001,
   "tier": "rare"
  },
  {
   "id": "time_blocking",
   "name": "Time blocking or hourly schedule",
   "have": [],
   "share": 0.0,
   "revenue_share": 0.0,
   "sales_share": 0.0,
   "tier": "not_seen"
  },
  {
   "id": "stickers",
   "name": "Digital stickers included",
   "have": [],
   "share": 0.0,
   "revenue_share": 0.0,
   "sales_share": 0.0,
   "tier": "not_seen"
  },
  {
   "id": "dark_mode",
   "name": "Dark mode",
   "have": [],
   "share": 0.0,
   "revenue_share": 0.0,
   "sales_share": 0.0,
   "tier": "not_seen"
  },
  {
   "id": "brain_dump",
   "name": "Brain dump pages",
   "have": [],
   "share": 0.0,
   "revenue_share": 0.0,
   "sales_share": 0.0,
   "tier": "not_seen"
  },
  {
   "id": "routines",
   "name": "Routine builder",
   "have": [],
   "share": 0.0,
   "revenue_share": 0.0,
   "sales_share": 0.0,
   "tier": "not_seen"
  },
  {
   "id": "dopamine_menu",
   "name": "Dopamine menu",
   "have": [],
   "share": 0.0,
   "revenue_share": 0.0,
   "sales_share": 0.0,
   "tier": "not_seen"
  },
  {
   "id": "priority_matrix",
   "name": "Priority matrix or top 3",
   "have": [],
   "share": 0.0,
   "revenue_share": 0.0,
   "sales_share": 0.0,
   "tier": "not_seen"
  },
  {
   "id": "quick_start",
   "name": "Quick start or setup guide",
   "have": [],
   "share": 0.0,
   "revenue_share": 0.0,
   "sales_share": 0.0,
   "tier": "not_seen"
  },
  {
   "id": "test_page",
   "name": "Link test or setup check page",
   "have": [],
   "share": 0.0,
   "revenue_share": 0.0,
   "sales_share": 0.0,
   "tier": "not_seen"
  }
 ],
 "complaints": [
  {
   "id": "c_download",
   "theme": "Couldn't download or open the file",
   "count": 38,
   "on_top_listings": 7,
   "quotes": [
    {
     "text": "unable to download it seems this is not my first digital planner but I was totally unable to download.",
     "shop": "ForLittleLion",
     "stars": 1,
     "review_id": "r161"
    },
    {
     "text": "Worst download ever, save your money.  Hard to download and impossible to use.",
     "shop": "phenixdigital",
     "stars": 1,
     "review_id": "r309"
    },
    {
     "text": "This product was very hard to use and I couldn't download it to use on my iPad or computer with having issues seeing part of the planning pages.",
     "shop": "FutureADHD",
     "stars": 1,
     "review_id": "r410"
    }
   ],
   "review_ids": [
    "r12",
    "r24",
    "r27",
    "r48",
    "r51",
    "r59",
    "r69",
    "r98",
    "r156",
    "r161",
    "r171",
    "r198",
    "r199",
    "r201",
    "r202",
    "r206",
    "r208",
    "r291",
    "r293",
    "r294",
    "r298",
    "r309",
    "r331",
    "r334",
    "r344",
    "r392",
    "r400",
    "r410",
    "r489",
    "r492",
    "r494",
    "r498",
    "r501",
    "r502",
    "r504",
    "r521",
    "r528",
    "r537"
   ]
  },
  {
   "id": "c_value",
   "theme": "Not worth the price",
   "count": 21,
   "on_top_listings": 4,
   "quotes": [
    {